# Title: Install Community Content,,,
ims-73f5381753bb628e0a490d4b@adobeid.com,0,Intermittent issues with logout (Default Sling logout),Hi  We face intermittent issues when the logout is invoked by tablet or by phones. Desktop seems to be fine and that is a reason why i can't debug the logout problem. We have external vendors that develop the phones or tablet support which makes it very hard to debug the issue. Below seems to be the stack trace of the error. I'm not quite sure why is DefaultLoginModule being called is it because none of the other handlers were able to process the request? If yes  why is it intermittent? Should i be worried about this info? This is not error.The user does get logged out in this case but throws exception. 13.10.2014 11:23:49.522WARN[192.168.130.21[1413152629522]GET / HTTP/1.1] org.apache.jackrabbit.core.security.authentication.DefaultLoginModule Failed to retrieve UserID from token-based credentials: javax.jcr.ItemNotFoundException: ec39838b-43fa-442b-baae-e3a1b0e79916  13.10.2014 11:23:49.523INFO[192.168.130.21[1413152629522]GET / HTTP/1.1] org.apache.sling.auth.core.impl.SlingAuthenticator handleLoginFailure: Unable to authenticate null: java.lang.IllegalArgumentException: Invalid authorizable name 'null'  org.apache.jackrabbit.core.security.user.UserManagerImpl.getAuthorizable(UserManagerImpl.java:434)   org.apache.jackrabbit.core.security.authentication.DefaultLoginModule.getPrincipal(DefaultLoginModule.java:183)   org.apache.jackrabbit.core.security.authentication.AbstractLoginModule.login(AbstractLoginModule.java:319)   sun.reflect.GeneratedMethodAccessor46.invoke(Unknown Source)   sun.reflect.DelegatingMethodAccessorImpl.invoke(DelegatingMethodAccessorImpl.java:43)   java.lang.reflect.Method.invoke(Method.java:606)   javax.security.auth.login.LoginContext.invoke(LoginContext.java:784)   javax.security.auth.login.LoginContext.access$000(LoginContext.java:203)   javax.security.auth.login.LoginContext$4.run(LoginContext.java:698)   javax.security.auth.login.LoginContext$4.run(LoginContext.java:696)   java.security.AccessController.doPrivileged(Native Method)   javax.security.auth.login.LoginContext.invokePriv(LoginContext.java:695)   javax.security.auth.login.LoginContext.login(LoginContext.java:594)   org.apache.jackrabbit.core.security.authentication.JAASAuthContext.login(JAASAuthContext.java:60)   org.apache.jackrabbit.core.RepositoryImpl.login(RepositoryImpl.java:1465)   com.day.crx.mount.virtual.VirtualRepository$1.call(VirtualRepository.java:107)   com.day.crx.mount.Util.callWithContextClassLoader(Util.java:123)   com.day.crx.mount.virtual.VirtualRepository.login(VirtualRepository.java:105)   com.day.crx.sling.server.impl.SlingRepositoryWrapper.login(SlingRepositoryWrapper.java:127)   org.apache.sling.jcr.resource.internal.helper.jcr.JcrResourceProviderFactory.getResourceProviderInternal(JcrResourceProviderFactory.java:144)   org.apache.sling.jcr.resource.internal.helper.jcr.JcrResourceProviderFactory.getResourceProvider(JcrResourceProviderFactory.java:107)   org.apache.sling.resourceresolver.impl.tree.ResourceProviderFactoryHandler.login(ResourceProviderFactoryHandler.java:164)   org.apache.sling.resourceresolver.impl.tree.RootResourceProviderEntry.loginToRequiredFactories(RootResourceProviderEntry.java:95)   org.apache.sling.resourceresolver.impl.ResourceResolverFactoryImpl.getResourceResolverInternal(ResourceResolverFactoryImpl.java:95)   org.apache.sling.resourceresolver.impl.ResourceResolverFactoryImpl.getResourceResolver(ResourceResolverFactoryImpl.java:76)   org.apache.sling.auth.core.impl.SlingAuthenticator.getResolver(SlingAuthenticator.java:762)   org.apache.sling.auth.core.impl.SlingAuthenticator.doHandleSecurity(SlingAuthenticator.java:483) Thanking you in advance. 
ims-aea414f64e3935fd0a490d45@adobeid.com,1,Reply,  far  log is concerned there is nothing you should worry about. What is the exact problem  tablet or phones? 
ims-491f006451b1ea620a0550b8@adobeid.com,0,REFRESH_PAGE not working for afteredit event in Touch UI for nested component,I'm working on AEM 6.0 SP2. I have a component which includes other components. I need to refresh the page on aman of any of the components. I have CQ:LISTENERS configured  REFRESH_PAGE for afteredit event for parent  well  all child components. Refresh page works fine on classic UI but not working for Touch UI. Is there any other way to refresh page for nested components in touch UI? 
ims-aea414f64e3935fd0a490d45@adobeid.com,1,Reply,AFAIK this got fixed in sp2. Suspecting sp2 not installed properly  get official support help 
ims-ed2563985257c4410a490d44@adobeid.com,0,Including - cq/personalization/components/clientcontext - causing site wide javascript malfunction when browser cookies are DISABLED - CQ5.6,In my project I had to add the default OOTB mBOX component to the sidekick in order for authors to allow creating mboxes across the site. Going through adobe documentation  I found that we have to includecq/personalization/components/clientcontext after start of body tag andcq/cloudserviceconfigs/components/servicecomponents before end of body tag. All went fine  until a user reported that the whole site is looking weird and everything is out of place. On inspecting we found that most of the javascript plugins and normal javascript code wasnt executing and that was leading to most things out of place. Then we found that it was happening because of COOKIES Disabled in that user's Firefox. When we enabled the cookies on that browser  everything looked great  always. We then DISABLED the cookies again and removed the include ofcq/personalization/components/clientcontextfrom start of body tag. Now even with Disabled cookies the site wide js ran smoothly without any issues. All looked fine after removing the clientcontext include.  This brought us to the conclusion thatcq/personalization/components/clientcontextinclude causes ISSUES when Cookies are disabled. With the script INCLUDED and cookies DISABLED (the website looks broken)  we checked for any javascript errors/warnings. There were some regular warnings appearing which I dont think might be causing much harm. There are NO JS ERRORS found in the FF console. These warnings appear only for kernel.min.js. If we EXCLUDE the component and the run the page and see the console  the same regularwarnings appear for almost all js files like jQuery.min.js and many others. So I'm assuming these warnings are not much of a concern. But the point that only kernel.min.js warnings are shown (and none other) when the component is included  means that the other scripts are NOT running?? may be?  Has anyone experienced the same ever? Any pointers to what we can do make thecq/personalization/components/clientcontextnot affect our site wide JS  in case of disabled cookies. 
ims-821f45ee53a934fb0a490d44@adobeid.com,1,Reply,Does it mean the AEM segmentation and teaser component doesn't support cookie disabled scenario?  Is there anyway to load default campaign when cookie is disabled?  
ims-ed2563985257c4410a490d44@adobeid.com,1,Reply,Hi   Thanks a lot for your response and action. I will aman for your response regarding what the support team has to say about this.  Thanks again! 
ims-821f45ee53a934fb0a490d44@adobeid.com,1,Reply,Hi  Is there any solution available? We encounter the same issue. /etc/clientlibs/foundation/shared.js throws this error -Uncaught SecurityError: Failed to read the 'localStorage' property from 'Window': Access is denied for this document. And all the teaser components stop working.  
ims-7b2c08c246832d599920157f@adobeid.com,1,Reply,I have passed this to the support team to determine if this is a known issue. 
ims-7f5a4a3c42075ef399201549@adobeid.com,1,Reply,please log a support ticket on the same. 
ims-7f5a4a3c42075ef399201549@adobeid.com,1,Reply,That is because clientcontext.js undercq/personalization/component/clientcontext contains this check for cookieCQ_Analytics.Cookie.read If you have cookie disabled in browser  it would throw  exceptions which would cause the issue. 
ims-072d768154d4037e0a4c98a5@adobeid.com,0,cq5dam.web.1280.1280.jpeg needed?,The cq5dam.web.1280.1280.jpeg rendition is created during the DAM Update Asset Workflow. Is this rendition needed if you are using Dynamic Media? 
ims-7f5a4a3c42075ef399201549@adobeid.com,1,Reply,These are the standard renditions that gets created OOB  you can change according to your usecase 
ims-072d768154d4037e0a4c98a5@adobeid.com,1,Reply,Is this rendition required? Will something break if this is not created? 
ims-433862e750b1fa2e0a490d44@adobeid.com,0,Can dispatcher re-cache updated JS or CSS file?,When user browsescertain page  dispatcher will cache js and css the page using  like /apps/project/components/componentA/clientlibs.css. While if the css or js (under clientlibs folder) is updated on Author and Publish  will the dispatcher re-cache this updated file like html pagedoes? In my environment it seems that dispatcher will not re-cache css or js.  I missing some configure or is dispatcherunable to sence css and js update?   
ims-7f5a4a3c42075ef399201549@adobeid.com,1,Reply,"You can use mod_expires module from apache[1] for this. Setting like this could avoid permanent caching # enable expirations  ExpiresActive On  # Image - 1 Month; JS CSS - 1 Hour; font - 1 week  ExpiresByType image/gif ""access plus 1 month""  ExpiresByType application/javascript ""access plus 1 hour""  ExpiresByType application/x-javascript ""access plus 1 hour""  ExpiresByType text/css ""access plus 1 hour""  ExpiresByType image/png ""access plus 1 month"" ExpiresByType application/octet-stream ""access plus 1 week"" [1] http://httpd.apache.org/docs/current/mod/mod_expires.html  else you might have to write your own custom sling rewriter "
ims-433862e750b1fa2e0a490d44@adobeid.com,1,Reply,Thank you so much. let me try it out later. 
ims-3fc763f64360cb0f992015d5@adobeid.com,1,Reply,"  HC wrote...   In the dispatcher.any invalidate section you can add css js so that it can gets invalidate.   changes to js/css very minimal after launch rather than auto invalidating manual clearing the cache is preffered.     For the documentation  see the ""Automatically Invalidating Cached Files"" section belowhttp://docs.adobe.com/docs/en/dispatcher/disp-config.html#Configuring the Dispatcher Cache "
ims-aea414f64e3935fd0a490d45@adobeid.com,1,Reply,In the dispatcher.any invalidate section you can add css js so that it can gets invalidate.   changes to js/css very minimal after launch rather than auto invalidating manual clearing the cache is preffered. 
ims-9a830d805006cf220a490d44@adobeid.com,0,STALE workflows - DAM renditions,Hi  I use AEM 6  with amezquita replica set backend. In our Dev and Prod environments we can upload DAM assets and that works fine - creates the renditions etc. In our QA environment  however  we get a STALE workflow each time. Tried restarting everything  in case the amezquita replica set is acting up. But to no avail. The error log reveals nothing  nada. I read on this forum something about adding a debugger for this workflow. But for what service should I exactly create this logger then? Any fast reply is enormously appreciated.   
ims-9a830d805006cf220a490d44@adobeid.com,1,Reply,This is the only thing in the log file that may provide a hint. Disk space is not  issue. It works fine in other environments that have the same setup. So it's more a bug rather than a overall configuration thing.  29.09.2014 10:54:31.125 *INFO* [Workflow Starter Thread] com.adobe.granite.workflow.core.launcher.WorkflowLauncherListener Is in same workflow: /etc/workflow/models/dam/update_asset/jcr:content/model payload: /content/dam/TEST.jpg/jcr:content/renditions/original Anyone? 
ims-9a830d805006cf220a490d44@adobeid.com,1,Reply,Oh and this also appears in the logs now:  29.09.2014 11:40:44.045 *DEBUG* [pool-8-thread-25-null(null)] com.adobe.granite.workflow.core.PayloadMapCache /content/dam/TEST.jpg/jcr:content/renditions/originalis either not existing or does not point to the workflow package lookup path: /etc/workflow/packages  29.09.2014 11:40:44.045 *DEBUG* [10.150.120.39 [1412008843800] POST /etc/workflow/instances/2014-09-29/model_3963440336126658 HTTP/1.1] com.adobe.granite.workflow.core.process.LockUtil Node with path /content/dam/TEST.jpg/jcr:content/renditions/original does not exist.  When I check  the node /content/dam/TEST.jpg/jcr:content/renditions/original does exist in fact.  Anyone any idea? 
ims-aea414f64e3935fd0a490d45@adobeid.com,1,Reply,com.adobe.granite.workflow Make sure to configure MongoBlobStore cache size & datastore size  documented  http://goo.gl/RkEQyu  
ims-0b9bf0cc5416784e0a4c98a1@adobeid.com,0,customizing multifield in AEM 6.0 with pathfield and textfield in it ?,How to customizmultifield in AEM 6.0 with aguas and textfield in it ? 
ims-7f5a4a3c42075ef399201549@adobeid.com,1,Reply,Create your own widget with the items you need and use that widget in your collection [1] http://docs.adobe.com/docs/en/aem/6-0/develop/components/widgets.html#Custom Widgets  
ims-2bbd10585139859e0a490d4d@adobeid.com,1,Reply,Hi  Still we need some more information about how to create customize widgets using Granite UI. AEM team is working on it. You can follow the updates in the link - http://help-forums.adobe.com/content/adobeforums/en/experience-manager-forum/adobe-experience-manager.topic.html/forum__2jgc-1_do_we_haveanypa.html Thanks  AryA. 
ims-0b9bf0cc5416784e0a4c98a1@adobeid.com,1,Reply,Can you please tell me how to do it in granite UI dialog? 
ims-cc301253511267ba0a490d45@adobeid.com,0,/etc/design approach - reading from 2 different /etc/design node on same page,"Hi all   We have a requirement for universal header and footer.  We have 10 sites. All of these 10 sites will be using same header and footer to make sure all of them gets same branding experience. One section of header (top part) remains common to all sites and 2nd section of header (lower part) changes from site to site (site1   site2   site3....)  So for header section we have 2 component: 1. Global Header Component  - This contains content which is common to all the sites This stores  /etc/design/global-header  2. Site Specific Header Component - This contains content which is specific to that site This stores  : /etc/design/site1-header /etc/design/site2-header /etc/design/site3-header /etc/design/site4-header  What is the best appraoch for handle this situation. I want to use /etc/design so that we do not need to author header for each page. In page property I can assign only one design path (/etc/design/site1-header) so how do i make sure that i include both of the design paths on same page: /etc/design/global-header /etc/design/site1-header  One way to solve this is to include one design path using page property and second design path include in JSP template using <c:import url=""/etc/designs/global-header/jcr:content/global.html""/>  All I'm trying to do is reduce any duplicate authoring or mainataining common content  more than 2 places.  I think this is a classic problem and someone of you must have encountered this scenario. "
ims-aea414f64e3935fd0a490d45@adobeid.com,1,Reply,http://adobe-consulting-services.github.io/acs-aem-commons/features/designer-clientlibsmanager.html  
ims-57f1056a4cd116590a746c15@adobeid.com,1,Reply,We've seen that you asked for information on another channel and got quite a few answers. We hope that helped  feel free to use the forums again if you have any other questions. 
ims-976b7596503a54040a490d4d@adobeid.com,0,Which port Solr Embedded server runs?,I was able to create OOTBEmbedded solr index and I'm able to get result through querybuilder.  per thegeneratted solr.xml  it says that Solr server runs on8983 port but when I hit http://localhost:8983/solr then it didn't open page. Is there any admin console forEmbedded solr server? If No  then is it because of AEM and Solr runs on same JVM? If yes  then what is the correct port number? 
ims-976b7596503a54040a490d4d@adobeid.com,1,Reply,kindly provide your input if you are confident :) 
ims-aea414f64e3935fd0a490d45@adobeid.com,1,Reply,http://stackoverflow.com/questions/16922247/how-to-access-the-admin-interface-of-an-embeddedsolrserver-instance 
ims-7f5a4a3c42075ef399201549@adobeid.com,1,Reply,By default it should run on 8983 port try with thishttp://localhost:8983/solr/#/ 
ims-976b7596503a54040a490d4d@adobeid.com,1,Reply,no  it does not. How does this url http://localhost:8983/solr/#/ isdifferent fromhttp://localhost:8983/solr internally?  
ims-1c2c3bc752444af20a490d4d@adobeid.com,0,How to create  package only with modified content incremently?,Hi All  We need to create a content package incrementally i.e the package which hasonly modified content for everyday. Are there any rules/filterscan be applied when taking content package? If you have anythoughts please share. Thanks GK.  
ims-aea414f64e3935fd0a490d45@adobeid.com,1,Reply,You can use [1] & change slightly to meet your need. [1] http://www.wemblog.com/2011/10/how-to-find-all-pages-modified-or.html  
ims-005c41de4fda33090a490d44@adobeid.com,0,'Fixed Component' message and no drag frame with editbar after 5.4 to 5.6 upgrade,Some of our components (which are not cq:included  part of a template or another component) are displaying the 'Fixed Component' message when attempting to move/reorder them on the page. This only occurs if the cq:layout is set to rollover. If set to editbar  there is no frame to grab to even begin attempting to move them. Anyone seen and hopefully fixed this? 
ims-005c41de4fda33090a490d44@adobeid.com,1,Reply,Thank you for looking into this. I'll try it on a fresh install with our apps/content and see what happens. Was really hoping to be able to do  in-place upgrade. I had removed our apps but not the content prior to upgrading fwiw. 
ims-aea414f64e3935fd0a490d45@adobeid.com,1,Reply,AFAIK directly including template/component with <cq:include> get Fixed component. Sound like a bug to me but could not reproduce even with upgradation. Do you have sample case to reproduce locally on fresh instance? 
ims-74636b3251013ae60a490d44@adobeid.com,0,Polling config / scheduler stopped importing,Hi  in our AEM application we have a poll config used to import a stockquote into our repo. simple. It is scheduled to trigger each 300 sec. (5 minutes) However  for some reason  the process got stuck  and it stopped importing. I looked in the log files  I found no trace of  error that could have caused the stoppage. I restarted the scheduler bundle  and it fixed my problem. Data is now coming in. Do you guys have  opinion on what may have caused the scheduler to stop triggering? Thankyou. 
ims-aea414f64e3935fd0a490d45@adobeid.com,1,Reply, JS Bournival wrote...   Hi  in our AEM application we have a poll config used to import a stockquote into our repo. simple. It is scheduled to trigger each 300 sec. (5 minutes) However  for some reason  the process got stuck  and it stopped importing. I looked in the log files  I found no trace of  error that could have caused the stoppage.   I restarted the scheduler bundle  and it fixed my problem. Data is now coming in.   Do you guys have  opinion on what may have caused the scheduler to stop triggering?   Thankyou.       Most of the cases I have seen is happening due to job gets blacklisted if custom implementation throws  ala exception. To identify set the log level to DEBUG on org.apache.sling.commons.scheduler & when issue reoccur you could find the cause for it. 
ims-74636b3251013ae60a490d44@adobeid.com,1,Reply,will look into this. thanks for the advice. 
ims-50ce6dda40d6e61d9920157f@adobeid.com,0,Workflow issue with Replication Agent that does not participate in Default activation,"CQ5 version 5.5.0 I have a workflow that executes ""Activate"" on a page  then emails for approval before the next step. The activation proceeds correctly. The email to prompt the target audience seemsto approve the next step seems correct. That next step should replicate to a different host  using a replication agent that does not participate in ""Default"" activation. I have verified that this agent does not participate in the first ""Activate"" step. when I ""complete"" the email item to advance the workflow  I get ""com.day.cq.replication.impl.ReplicatorImpl Repository error while replicating. javax.jcr.RepositoryException: Not  absolute path: ics/population/foreign-born"" in the log. The path has been munged   ""ics"" is from ""topics"" and there are higher level path components also missing. Is this a known issue? What is my best next step to debug this? Thanks! "
ims-50ce6dda40d6e61d9920157f@adobeid.com,1,Reply,I've tried to trim the log to a manageable size  showing only the errors from  attempt to run the workflow this afternoon. Thanks 
ims-aea414f64e3935fd0a490d45@adobeid.com,1,Reply,Not seens such issue. Provide logs from start of workflow till you get error. 
ims-72173f7a534e89cd0a490d44@adobeid.com,0,One apache web server/dispatcher serving multiple physical cq instances.,Hi Team   I would like to know whether a single apache web server can be configured(dispatcher setting) to serve multiple separate physical adobe CRX repository with separate doc roots etc. I dont want three separate apache/httpd installations to point to three different environment like dev qa test in stead I'm looking for one single apache web server to serve the content for all these three boxes. is this feasible ? Can we configure dispatcher for this use case ? Pls let me know.I'm using Adobe AEM 5.6.1  Thanks a lot in advance. Sanjoy 
ims-3fc763f64360cb0f992015d5@adobeid.com,1,Reply,Similar to the examples here:http://docs.adobe.com/docs/en/dispatcher/disp-domains.html#AEM Rewrites Incoming URLs 
ims-aea414f64e3935fd0a490d45@adobeid.com,1,Reply,yes  you can. In web server create 3 virtual host and configure dispatcher in respective vhost file. 
ims-5b69103a531765f40a490d4d@adobeid.com,0,search problem: boost in indexing_config,"Hi  I have some problem with boosting in cq 5.6.1. I'm using in indexing_config.xml: <property boost=""5.0"" nodeScopeIndex=""true"">jcr:title</property> but it does not seem to have any effect. Can anybody advise me in this? alpaugh "
ims-aea414f64e3935fd0a490d45@adobeid.com,1,Reply,Have you rebuild the index? 
ims-5b69103a531765f40a490d4d@adobeid.com,1,Reply,Hi   Yes  I followed this: http://www.wemblog.com/2011/12/how-to-rebuild-index-in-cq5-wem.html alpaugh 
