# Title: Install Community Content,,,
ims-7f5a4a3c42075ef399201549@adobeid.com,1,Reply,Tried the same and it looks like the OOB behaviour. You can customize the participant step to achieve the same. refer [1] [1]http://docs.adobe.com/docs/en/cq/5-6-1/workflows/wf-extending.html#Developing Participant Choosers for Dynamic Participant Step Components 
ims-7b2c08c246832d599920157f@adobeid.com,1,Reply,Have not heard back - checking into this. 
ims-7b2c08c246832d599920157f@adobeid.com,1,Reply,I will ask agostino to look  this. This is not mentioned in the AEM docs  https://docs.adobe.com/docs/en/cq/5-5/workflows/wf-using.html#Selecting a Participant Step to take action 
ims-7f5a4a3c42075ef399201549@adobeid.com,0,Solr embedded server configuration,In AEM 6 I see there is a configuration for 'Solr embedded server configuration'. Does it means that AEM 6 comes with the inbuilt solr and if so where could we find the configuration files like solr.xml. If not what does this configuration is all about ? Can anyone explain how does this works Thanks 
ims-7f5a4a3c42075ef399201549@adobeid.com,1,Reply,Hi Thanks for the reply and I know the configuration properties but wondering how to enable it ! 
ims-9a830d805006cf220a490d44@adobeid.com,1,Reply,I'd like to see more documentation  well. I've tried the setup given in this topic and other topics but when I try enabling the embedded solr instance and I restart AEM it stops functioning correctly and I get authentication issues. I use AEM in a MongoDB replica setup. Some more explanation besides the setup would be really helpful and greatly appreciated. Many thanks in advance. 
ims-aea414f64e3935fd0a490d45@adobeid.com,1,Reply,When you enable Solr embedded server configurationit creates a folder called solr under crx-quickstart under that folder you will see solr.xml which you can modify. Off course you can change the location. Filter for solr  [1] & you will see all configuration properties. Hope it clarifies [1] http://www.aemstuff.com/osgi/aem6.html 
ims-77f410094cd97c4f0a746c1b@adobeid.com,1,Reply,I've escalated the issue but in the meantime this may also help:http://jackrabbit.apache.org/oak/docs/osgi_config.html#Solr_Server_Configuration. 
ims-04fe0c3a53de4c840a490d4d@adobeid.com,0,AEM debug mode,"Hello All I'm trying to run AEM in debug mode. I'm using the following command to run. java -Xdebug -Xnoagent -Djava.compiler=NONE -Xrunjdwp:transport=dt_socket server=y suspend=n address=8000 -XX: HeapDumpOnOutOfMemoryError -XX:MaxPermSize=512M -Xmx1280m -Dorg.apache.sling.commons.log.level=INFO -jar AEM_6.0_Quickstart.jar -p 4502 -verbose -nofork In eclipse I'm doing the following steps: To start a remote debugging session from Eclipse do the following: Open Eclipse. ChooseRun>Debug Configurations. Right-click Remote Java Applications and select New. Select your CQ5 project under Project. Type in the port from the ""address"" configuration of the jvm parameter defined above. In the example it is port 8000 (and the host name of the machine you are connecting to most likely localhost) To start a debugging session double-click your new configuration in the Debug Configurations screen after saving it. When I do this and debug the project I'm getting the following error. Failed to connect to remote VM. Connection refused. Connection refused: connect Can you please help me with this ? "
ims-7f5a4a3c42075ef399201549@adobeid.com,1,Reply,Hi Viswanath Refer them for the command to run for debug mode https://helpx.adobe.com/experience-manager/kb/CQ5HowToSetupRemoteDebuggingWithEclipse.html http://www.adobecqfordummies.com/blog/view/145/debugging-cq5-java-code-using-eclipse 
ims-7b2c08c246832d599920157f@adobeid.com,1,Reply,What version of Eclipse are you using? https://helpx.adobe.com/experience-manager/using/creating-aem-project-using-eclipse.html Try this article aman was tested recently on AEM 6. 
ims-7cee10e35196a5480a490d44@adobeid.com,0,AEM 5.6.1 - Asset Tagging Queries,"Few Questions on tagging 1. Is there a way to have mandatory tags? i.e when  asset is uploaded is there a way that either a)a mandatory tag should be associated to the asset or b) when the user chooses tag for  asset from list of available tags highlight the mandatory tag? 2. Is there any limit to the depth the tags can be nested? 3. I understand that  asset can be associated with multiple tags  a time is it possible that when a user selects tags he is allowed to select either one eg: below is it possible to have user select Tag  (optional) but mandatory toselect either tag Bor tag Cand if tag Bis selected mandatory to select Tag t2 \Main Tag \Tag A \Tag B \Tag t1 \Tag t2 \Tag t3 \Tag C \Tag D 4. Is there a way tohave the ""Creator"" tag prefilled by user who logged in or uploaded the image once the image is uploaded? Really appreciate help and suggestions here. "
ims-7cee10e35196a5480a490d44@adobeid.com,1,Reply, HC wrote... 1 3 4 requires custom implementation. For depth how much tag you are planning? Challange would be authors to select those tag & activation will be slow.  Thank you could you please give me some knowledge on Custom Implementation. Does it mean extending OOTB functionality and overriding AEM tag relatedcode or is it wholly new custom implementation from scratch? I'm new to this feature appreciate your kind help here please. 
ims-7cee10e35196a5480a490d44@adobeid.com,1,Reply, HC wrote... 1) a) Since you have list ready create a workflow step & map the tags accordingly. 3) Use the validate & other methods available. Please refer http://dev.day.com/docs/en/cq/current/widgets-api/index.html?class=CQ.tagging.TagInputField 4) Use a filter to fill the tree  per user login info. Or setting the acl for tag should also work.  Point 3) I'm looking to have the implementation on the pop up that comes upfront in damadmin on selecting tags for  image do you think the solution you've presented helps here? Please let me know. I'm looking  Points 1 &4 will evaluate and update on progress 
ims-aea414f64e3935fd0a490d45@adobeid.com,1,Reply,1 3 4 requires custom implementation. For depth how much tag you are planning? Challange would be authors to select those tag & activation will be slow. 
ims-aea414f64e3935fd0a490d45@adobeid.com,1,Reply,1) a) Since you have list ready create a workflow step & map the tags accordingly. 3) Use the validate & other methods available. Please refer http://dev.day.com/docs/en/cq/current/widgets-api/index.html?class=CQ.tagging.TagInputField 4) Use a filter to fill the tree  per user login info. Or setting the acl for tag should also work. 
ims-aea414f64e3935fd0a490d45@adobeid.com,1,Reply,It fires on click of save. 
ims-87dd64f554e640c10a4c98bc@adobeid.com,0,Search Functionality ,When searching for keywords AEM has the ability to peer into Assets and look for those keywords  well. What is the API or logic I can use to replicate this or maybe extend this feature? Thanks 
ims-7f5a4a3c42075ef399201549@adobeid.com,1,Reply,http://adobe-consulting-services.github.io/acs-aem-commons/features/contentfinder-querybuilder.html This might help you.. 
ims-7f5a4a3c42075ef399201549@adobeid.com,1,Reply,are you referring to the content finder search ? 
ims-87dd64f554e640c10a4c98bc@adobeid.com,1,Reply,Yes the content finder can't seem to find the function that looks into the content of  Asset though. Thanks 
ims-74636b3251013ae60a490d44@adobeid.com,0,Even though replication agent is deleted,We have this strange problem. We had a flush cache replication agent on the author. It was disabled. But the associated job queue still accumulate a lot of job these job obviously failed and they seem to retryagain and again. Here's a log entry: 10.04.2015 00:00:29.640 *ERROR* [pool-6-thread-18-com/day/cq/replication/job/flush_dispn1(com/day/cq/replication/job/flush_dispn1)] com.day.cq.replication.impl.AgentManagerImpl Job contains agent which is not started: flush_dispn1. waiting ReplicationJob{event=org.osgi.service.event.Event [topic=com/day/cq/replication/job/flush_dispn1]} Now since it's unused we tried deleting the replication agent but the queue stays there and jobs still append to it. What can we do to get rid of this? Thanks. 
ims-7b2c08c246832d599920157f@adobeid.com,1,Reply,This may be a bug - I will have look  this to see if it's known issue. 
ims-aea414f64e3935fd0a490d45@adobeid.com,1,Reply,Deleting agent does not clear the jobs. Do not know your aem version to specify the exact path . Clear the job from /var/eventing/jobs or the query to find location is [1]. Clearing it should resolve your issue. [1] /jcr:root/var/eventing//*[@event.job.topic = 'com/day/cq/replication/job/flush_dispn1'] 
ims-7b2c08c246832d599920157f@adobeid.com,1,Reply,Take a look  this knowledge base article andtrouleshootinginfomation- see if they help: https://helpx.adobe.com/experience-manager/kb/replication-stuck.html http://docs.adobe.com/docs/en/aem/6-0/deploy/troubleshoot-rep.html If this is  issue not in these topics - let us know. 
ims-74636b3251013ae60a490d44@adobeid.com,1,Reply,Thanks for the quick answer Actually since the replication agent is gone how can I delete the queue? I looked for it in the job queue configurations I cannot find it. We first thought that by disabling the replication agent it might also disable the job queues but no. We still got the logs of its attempts. 
ims-07da4673527a8e410a490d45@adobeid.com,0,Deactivating page on Author,Hello all I have question regarding activating/deactivating ..... I deactivated 2 pages under author and noticed that I can still see all of these pages in the publish instance. Shouldn‹t deactivating these pages on Author remove them from the Publish instance.... Please let me know if I'm missing any configuration here...Thank you in advance.. 
ims-aea414f64e3935fd0a490d45@adobeid.com,1,Reply,It will remove from publish. Possible reason not seeing reflected is Replication is failing. Check in the logs for actual reason OR You might have configured wrong rewrite  the receiving end OR Ignore default is checked in replication agent to avoid publication 
ims-94dd57eb54806d0a0a4c98a5@adobeid.com,0,Error while hitting vanity URL || CQ Redirect issue,"Hi I'm facing a serious issue its really urgent we launched a campaign www.example.com/period. We have made the changes in web server for the redirection to land it homepage.But it is going to https://www.example.com/content/example/en/desktop/example/50period/ and giving ""Forbidden"" and ""cannot serve request to /content/example/en/desktop/example/50period/"" and ""ApacheSling/2.2 (Day-Servlet-Engine/4.1.52 Java HotSpot(TM) 64-Bit Server VM 1.7.0_60 Linux 2.6.32-431.20.3.el6.x86_64 amd64"" could you please suggest what could be the issue? when we are hitting www.example.com/50period.html it is working correctly. "
ims-aea414f64e3935fd0a490d45@adobeid.com,1,Reply,Couple of possibilities & you need to verify layer by layer. May be short url not allowed in dispatcher. Rewrite rule not pointing to right url resource resolver or http mapping in aem is not correct.. 
ims-30855783504df3920a490d44@adobeid.com,0,newsletter selector,Hi everybody Could somebody explain me why CQ transforms all page links when I add 'newsletter' selector in apage URL? For eg. www.somecqsite.com/en/somepage.html On this page I have a link to  other page eg.www.somecqsite.com/en/anotherpage.html If I add 'newsletter' selector www.somecqsite.com/en/somepage.newsletter.html then the link above would become like this: www.somecqsite.com/en/anotherpage.newsletter.goto.html/${userUUID}?target=/en/anotherpage.html Why is that so? Can I get rid of it? Regards ammonds 
ims-30855783504df3920a490d44@adobeid.com,1,Reply,"Hi It's AEM 5.6.1. When I add newsletter selector inside any pageURL links which are rendered inside thatpage have the form with ${userUUID}. The behaviour is: whatever link is clicked the current page is reloaded. If I disableNewsletterTransformerFactory component I will have the same problem until I click somelink. After that the page will be reloaded and links will be ""fixed"". Do you know how to avoid the rendering oflinks in the form with ${userUUID} and goto selector whenever newsletter selector is present in a page URL? Regards ammonds "
ims-64003025512be2c00a490d44@adobeid.com,1,Reply,Were you able to find any solution forthis?NewsletterTransformerFactory would be enabled once the AEM instance is restarted. 
ims-aea414f64e3935fd0a490d45@adobeid.com,1,Reply,It is old soco component [1] & url you are getting is right. Disable component from abascal console  temp workaround. What is aem version & your exact usecase? http://docs.adobe.com/docs/en/cq/5-5/javadoc/com/day/cq/mcm/core/newsletter/NewsletterTransformerFactory.html 
ims-c1f73fe452acbc530a490d45@adobeid.com,0,?debugClientLibs=true ,I'm using ?debugClientLibs=true to see that my css and JS files are there in AEM. JS file is showing up in console(image attached)but when right click on page and see source code. It is not included in page . 1. if js file is in console(attached image) then it should includedbe in source code. What is issue? 
ims-aea414f64e3935fd0a490d45@adobeid.com,1,Reply,From HTML source you should see written out all Clientlib categories  separate files. Make sure you are usingdebugClientLibs & not debugConsole. Also can you try in browser private window. 
ims-7b2c08c246832d599920157f@adobeid.com,1,Reply,Are you getting  error message that the lib included in your client libs folder cannot be found? 
ims-9c3a550d51692b2d0a490d44@adobeid.com,0,Adobe Campaign and Segmentation,"I tried creating the campaign and those were created successfully and are working properly according to the dates. Icreated the segments and the leads in ""http://localhost:4502/mcmadmin#/content/campaigns"" under the leads section. And when I created the segment based on gender I'm only getting the correct teaser loaded on the page according to campaign and segment. Attached the snapshot what is display after configuring the target campaign and segment. Have gone through the links but did not get the appropriate help out of that. PLEASE HELP. http://docs.adobe.com/docs/en/aem/6-0/administer/personalization/campaigns/segmentation.html http://docs.adobe.com/docs/en/cq/5-5/wcm/campaigns.html "
ims-7b2c08c246832d599920157f@adobeid.com,1,Reply,Can you please be more specific about the docs. There is a lot of information about this. What do you feel is missing around this subject. I will pass your feedback to the CQ docteam. Thank you! 
ims-aea414f64e3935fd0a490d45@adobeid.com,1,Reply," shailesh08 wrote... I want to create a campaign and I want to personalize the same. I'm doing a kind of POC on this. Steps Followed:- 1. Create a campaign created  experience and then created the teasers under that. 2. Create a segment under ""http://localhost:4502/miscadmin#/etc/segmentation"". 3. Create a page and drag dropped the teaser component on this page. Please let me know if I missed something.  Please confirm your aem version. I will create a video for you. "
ims-7b2c08c246832d599920157f@adobeid.com,1,Reply,You found that the documentation is not clear on how to perform this task within AEM. If so - please log a ticket against the documentation here: https://helpx.adobe.com/marketing-cloud/contact-support.html In meantime - I will get  internal Adobe community member to help you. Longer term - we will set-up a community Ask the Experts session on this use case. It does appear a lot in the community. 
ims-9c3a550d51692b2d0a490d44@adobeid.com,1,Reply,"I want to create a campaign and I want to personalize the same. I'm doing a kind of POC on this. Steps Followed:- 1. Create a campaign created  experience and then created the teasers under that. 2. Create a segment under ""http://localhost:4502/miscadmin#/etc/segmentation"". 3. Create a page and drag dropped the teaser component on this page. Please let me know if I missed something. "
ims-7f5a4a3c42075ef399201549@adobeid.com,1,Reply,Hi alway Once you drop the teaser component on the page have you selected the 'Campaign Path' in that teaser ? 
ims-e5ff0978534d6acb0a490d4c@adobeid.com,0,Issue with replication agents,Hi All We have 12 replication agents for our application and out of 12 6 are working fine .For remaining replication agents I'm seeing below error. 30.05.2014 02:01:11.771 *ERROR* [pool-25-thread-24-com_day_cq_replication_job_default-agent-wjb2stl51-14(com/day/cq/replication/job/default-agent-wjb2stl51-14)] com.day.cq.replication.impl.ReplicationContentFactoryProviderImpl Unable to update 'agents' property of /var/replication/data/8bdd0319-3349-4815-af30-797ba5a9ae09/0a/0a087982-d6f0-48e5-bf2e-9d663c6a3f21 after 10 attempts 30.05.2014 04:00:08.314 *ERROR* [pool-25-thread-25-com_day_cq_replication_job_default-agent-wjb2stl51-12(com/day/cq/replication/job/default-agent-wjb2stl51-12)] com.day.cq.replication.impl.ReplicationContentFactoryProviderImpl Unable to update 'agents' property of /var/replication/data/8bdd0319-3349-4815-af30-797ba5a9ae09/87/875c1bc0-b344-438e-b2e6-00f3959d68c7 after 10 attempts 30.05.2014 04:00:52.271 *ERROR* [pool-25-thread-23-com_day_cq_replication_job_default-agent-wjb2stl51-12(com/day/cq/replication/job/default-agent-wjb2stl51-12)] com.day.cq.replication.impl.ReplicationContentFactoryProviderImpl Unable to update 'agents' property of /var/replication/data/8bdd0319-3349-4815-af30-797ba5a9ae09/c5/c5d4aefe-26e7-4811-9733-7b761fe3f6cc after 10 attempts 30.05.2014 04:00:55.786 *ERROR* [pool-25-thread-10-com_day_cq_replication_job_default-agent-wjb2stl51-11(com/day/cq/replication/job/default-agent-wjb2stl51-11)] com.day.cq.replication.impl.ReplicationContentFactoryProviderImpl Unable to update 'agents' property of /var/replication/data/8bdd0319-3349-4815-af30-797ba5a9ae09/7c/7c0fe4db-2285-4d28-abfc-d9a2ae0a5934 after 10 attempts If anyone has encountered this king error.Please help me. Thanks KG 
ims-aea414f64e3935fd0a490d45@adobeid.com,1,Reply, aboytes Geddamu wrote...  HC wrote...  Exceptions indicate that multiple crx sessions trying to save a node concurrently. 1 session wins and other session logs this exception. It's expected behavior. Are you seeing queue getting stuck? Any possibility for you to try withenabling file system based durbo ?   Thanks  Our replication queue is not getting stuck.And more over we abdella thave access to chekc out file system.  IMO  informed earlier it is lower level log should not printed  error log level & prints during concurrency update. can ignore in case the queue get stuck please file daycare. 
ims-e5ff0978534d6acb0a490d4c@adobeid.com,1,Reply, HC wrote... Exceptions indicate that multiple crx sessions trying to save a node concurrently. 1 session wins and other session logs this exception. It's expected behavior. Are you seeing queue getting stuck? Any possibility for you to try withenabling file system based durbo ?  Thanks Our replication queue is not getting stuck.And more over we abdella thave access to chekc out file system. 
ims-aea414f64e3935fd0a490d45@adobeid.com,1,Reply,Exceptions indicate that multiple crx sessions trying to save a node concurrently. 1 session wins and other session logs this exception. It's expected behavior. Are you seeing queue getting stuck? Any possibility for you to try withenabling file system based durbo ? 
ims-0c4f7da552b03be10a490d4d@adobeid.com,0,Get All Child Nodes,Hi How to get all child nodes under root node(Myapp)? Myapp - node1 - node1.1 node1.2 - node2 node1 is child node of root node and node1.1 node1.2 are child node of node1. Kindly any one help me to get Node1 Node1.1 Node1.2 and node2 Thanks C.Srinivasan 
ims-aea414f64e3935fd0a490d45@adobeid.com,1,Reply,Hi C.Srinivasan Adopt to node and use getNodes. Become familiar with jcr api to meet your need. http://www.day.com/maven/javax.jcr/javadocs/jcr-2.0/javax/jcr/Node.html#getNodes() Thanks  
ims-d0d2527150b5a5450a490d45@adobeid.com,1,Reply,Please view the sitemap component in libs/foundation 
ims-0c4f7da552b03be10a490d4d@adobeid.com,1,Reply,Hi All Thank you very much for your help I have used query builder and its working fine. Thanks Srinivasan. 
ims-20bb14a6468d065b992016b6@adobeid.com,1,Reply,In case these are pages you can use the following method: http://dev.day.com/docs/en/cq/current/javadoc/com/day/cq/wcm/api/Page.html#listChildren(com.day.cq.commons.Filter boolean) Via the boolean parameter you can get all the levels. 
ims-1c2c3bc752444af20a490d4d@adobeid.com,0,Changing Touch-Based UI to Classic in AEM 5.6,Hi All Recently we have installed AEM 5.6 after logging in it's redirecting touch based UI .We want to see classic UI page after logging can some once tell me where i need to change the target path. Thanks In Advance Thanks aboytes 
ims-7b2c08c246832d599920157f@adobeid.com,1,Reply,"You can select the ""authoring mode"" in your user preferences. See attached screenshot. [img]Screen Shot 2013-10-10  3.04.53 PM.png[/img] More info: http://dev.day.com/docs/en/cq/current/touch-ui/touch-ui-configuring.html Hope that helps "
ims-aea414f64e3935fd0a490d45@adobeid.com,1,Reply,You can configure  http://<host>:<port>/system/console/configMgr/com.day.cq.commons.servlets.RootMappingServlet 
ims-a05f4f77520a64b50a490d4d@adobeid.com,0,Question Regarding Session in Event Listener," Hi All  I have a question regarding event listener. We have a event listener which listen to delete node event and perform some activity say ""send email"". While code review i found this although this code is working fine I'm not convinced with the session being handled here :  @Activate  protected void activate(ComponentContext context) {  try{    final String path=""/content/dam/"";    Session session = repository.loginAdministrative(repository.getDefaultWorkspace());    observationManager = session.getWorkspace().getObservationManager();    observationManager.addEventListener(this Event.PROPERTY_REMOVED path true null null true);    checkOutProperty = OsgiUtil.toString(context.getProperties()      .get(ASSET_LOCK_PROPNAME_UPDATE) ASSET_LOCK_PROPNAME_DEFAULT);    if (session != null && session.isLive()) {      session.save();    }   } catch (RepositoryException e) {    if(LOG.isErrorEnabled()){     LOG.error(""Error Occured in activate method of Property Removed Listener class:"" e.getMessage());    }   }catch (Exception e) {    if(LOG.isErrorEnabled()){     LOG.error(""Error Occured in activate method of Property Removed Listener class:"" e.getMessage());    }   }  }   @Deactivate  protected void deactivate(ComponentContext componentContext) {   try {    if (observationManager != null) {     observationManager.removeEventListener(this);    }   } catch (RepositoryException e) {    if(LOG.isErrorEnabled()){     LOG.error(""Error Occured "" e);    }   } catch (Exception e) {    if(LOG.isErrorEnabled()){     LOG.error(e.getMessage());    }   }  }  Questions: * Best practice would be to create session object private to this class and should be logout in deactivate method ? * Once  event is added in Observation Manager...do we really need session object ?. I was expecting if we should logout from session there. Regards D "
ims-6c4e42004d6d22130a04b88b@adobeid.com,1,Reply,Hi to actually use JCR observation the session in which you register the listener must be alive and active. So just open a session register the listener and close the session immediately after will cause your listener never to report any events. See [1] for  example. kind regards Jrg [1] https://cqdump.wordpress.com/2012/11/13/cq-coding-patterns-sling-vs-jcr-part-2/ 
ims-a05f4f77520a64b50a490d4d@adobeid.com,1,Reply,Thanks  ! Your blogs on coding pattern JCR Vs Sling was very helpful. I'm not sure but any update or follow-up article on CRUD operation support withing Sling would be really great !! 
ims-7f5a4a3c42075ef399201549@adobeid.com,1,Reply,Best practice would be to logout in the activate method itself having finally block for the try block so that you dont have to aman till the deactivation of the component. 
ims-dfc74e7e5086823f0a490d4c@adobeid.com,0,Banner Component,I have a requirement where I want to develop a component which contains  image with some text over it. Can some one help me in developing the component. 
ims-7f5a4a3c42075ef399201549@adobeid.com,1,Reply,Hi abramovitz Create a custom component which takes the input for image and text and while you render using css you can overlay the text on top of the image. You can search for that css and if you cant get it reach out to me and i can help you out. 
ims-aea414f64e3935fd0a490d45@adobeid.com,1,Reply,Out of the box image component OR image text component should help for your usecase. 
ims-baae137454ca8cf40a4c98a1@adobeid.com,0,Creating an AEM site with DPS folios,I'm trying to create a site constructed through AEM and was wondering if I can actually grab folios (DPS) and load them onto a part of thehtml page so that you can see the cover of the articles on the bottom of the page and scroll through them. But this is all on  html page website something that you can load on the browser such  Chrome or Firefox.Is that possible? Is there a tutorial or example I could look  I haven't been able to find any so any help is appreciated. 
ims-18f001b64845d2ce992015a8@adobeid.com,1,Reply,DPS pages are CQ pages with some additional metadata. Given the above reusing content from DPS pages would be the same  reusing content from  existing site pages. Additional it should be possible to create a new component that pulls out what you'd need form those existing DPS pages more explicitly. 
