# Title: Install Community Content,,,
ims-aea414f64e3935fd0a490d45@adobeid.com,1,Reply," abdulaziz wrote... Thanks a lot for the response. So here are the important log lines above. Actually I really abdella t know whats going wrong here. It would be great if someone would have any idea what I could do in order to solve this bad issue. Thanks a lot !!  17.11.2014 13:50:45.360 *INFO* [172.20.6.15 [1416228645358] GET /saml_login HTTP/1.1] org.apache.sling.engine.impl.SlingRequestProcessorImpl service: Resource /saml_login not found 17.11.2014 13:50:51.114 *INFO* [172.20.6.15 [1416228651057] POST /saml_login HTTP/1.1] org.apache.jackrabbit.core.persistence.bundle.AbstractBundlePersistenceManager cachename=crx.defaultBundleCache[ConcurrentCache@5a26ce82] elements=2216 usedmemorykb=8190 maxmemorykb=8192 access=214884 miss=20323 17.11.2014 13:50:51.121 *INFO* [172.20.6.15 [1416228651057] POST /saml_login HTTP/1.1] org.apache.jackrabbit.core.persistence.bundle.AbstractBundlePersistenceManager cachename=versionBundleCache[ConcurrentCache@c9a3475] elements=1559 usedmemorykb=1573 maxmemorykb=8192 access=24130 miss=1559 17.11.2014 13:50:51.227 *INFO* [172.20.6.15 [1416228651212] GET /content/geometrixx/en.html HTTP/1.1] com.day.cq.wcm.core.impl.variants.PageVariantsProviderImpl Missing or empty cq:variantDomain property for site variant /content/geometrixx_mobile/jcr:content/cq:siteVariant; will generate relative links 17.11.2014 13:50:51.229 *INFO* [172.20.6.15 [1416228651212] GET /content/geometrixx/en.html HTTP/1.1] com.day.cq.wcm.core.impl.variants.PageVariantsProviderImpl Missing or empty cq:variantDomain property for site variant /content/geometrixx/jcr:content/cq:siteVariant; will generate relative links 17.11.2014 13:50:51.236 *INFO* [172.20.6.15 [1416228651212] GET /content/geometrixx/en.html HTTP/1.1] com.day.cq.wcm.core.impl.devicedetection.DeviceIdentificationModeImpl Found cq:deviceIdentificationMode property with value client-side on node /content/geometrixx for page /content/geometrixx/en 17.11.2014 13:50:51.245 *WARN* [172.20.6.15 [1416228651212] GET /content/geometrixx/en.html HTTP/1.1] com.adobe.granite.security.user.internal.UserPropertiesServiceImpl Requested adapter type not supported: com.adobe.granite.security.user.UserProperties And in the browser I get following response: You abdella t have permission to access /content/geometrixx/en.html on this server.  GET /saml_login indicates you have lost cookie some where in the tier you need to identify who is resetting & fix it. There is one scenario which happens & I doubt it applies to you based on your earlier description.  informed earlier in my post enable debug for ""com.adobe.granite.auth.saml"" send enabled output along with saml response. OR file a official support request. "
ims-429a138653c69a3f0a490d45@adobeid.com,1,Reply,Thanks a lot for the response. So here are the important log lines above. Actually I really abdella t know whats going wrong here. It would be great if someone would have any idea what I could do in order to solve this bad issue. Thanks a lot !! 17.11.2014 13:50:45.360 *INFO* [172.20.6.15 [1416228645358] GET /saml_login HTTP/1.1] org.apache.sling.engine.impl.SlingRequestProcessorImpl service: Resource /saml_login not found 17.11.2014 13:50:51.114 *INFO* [172.20.6.15 [1416228651057] POST /saml_login HTTP/1.1] org.apache.jackrabbit.core.persistence.bundle.AbstractBundlePersistenceManager cachename=crx.defaultBundleCache[ConcurrentCache@5a26ce82] elements=2216 usedmemorykb=8190 maxmemorykb=8192 access=214884 miss=20323 17.11.2014 13:50:51.121 *INFO* [172.20.6.15 [1416228651057] POST /saml_login HTTP/1.1] org.apache.jackrabbit.core.persistence.bundle.AbstractBundlePersistenceManager cachename=versionBundleCache[ConcurrentCache@c9a3475] elements=1559 usedmemorykb=1573 maxmemorykb=8192 access=24130 miss=1559 17.11.2014 13:50:51.227 *INFO* [172.20.6.15 [1416228651212] GET /content/geometrixx/en.html HTTP/1.1] com.day.cq.wcm.core.impl.variants.PageVariantsProviderImpl Missing or empty cq:variantDomain property for site variant /content/geometrixx_mobile/jcr:content/cq:siteVariant; will generate relative links 17.11.2014 13:50:51.229 *INFO* [172.20.6.15 [1416228651212] GET /content/geometrixx/en.html HTTP/1.1] com.day.cq.wcm.core.impl.variants.PageVariantsProviderImpl Missing or empty cq:variantDomain property for site variant /content/geometrixx/jcr:content/cq:siteVariant; will generate relative links 17.11.2014 13:50:51.236 *INFO* [172.20.6.15 [1416228651212] GET /content/geometrixx/en.html HTTP/1.1] com.day.cq.wcm.core.impl.devicedetection.DeviceIdentificationModeImpl Found cq:deviceIdentificationMode property with value client-side on node /content/geometrixx for page /content/geometrixx/en 17.11.2014 13:50:51.245 *WARN* [172.20.6.15 [1416228651212] GET /content/geometrixx/en.html HTTP/1.1] com.adobe.granite.security.user.internal.UserPropertiesServiceImpl Requested adapter type not supported: com.adobe.granite.security.user.UserProperties And in the browser I get following response: You abdella t have permission to access /content/geometrixx/en.html on this server. 
ims-aea414f64e3935fd0a490d45@adobeid.com,1,Reply,Answer to you question:- First user is created or updated Then user is added into group Note:- Permission is never assigned to group. You have to set manually by creating group well in advance OR assign permission after group is created. Coming to original 403 looks interesting following are situation [1] it can happen. If you are not encountering same please provide more information [2]. [1] Referrer filter is not configured SP2 not installed Their might be matching user instead of group for the value of group returned from saml. [2] Saml response especially group attributes value Enable debug for saml and attach the log files. Snapshot of abascal console saml config. 
ims-0ad20cdb53e9ad580a490d4e@adobeid.com,1,Reply,Hi It seems like for AEM 6.0 sp1 it must provide group attribute in saml response from IDP side right? if IDP doesn't configure the group attribute it will get the HTTP 403 error in AEM right? So that's why groupmembership attribute in AEM saml handler needed? How about using default group attribute instead of groupmembership attribute and leave it groupmembership blank? Best Wishes abdou 
ims-0ad20cdb53e9ad580a490d4e@adobeid.com,1,Reply,Hello Did you fix this problem? Any work around solution for saml authentication in AEM 6.0 sp1? I got the same problem  you. Any suggestions are appreciate. 
ims-e9453637539ad78b0a490d44@adobeid.com,0,"Certain images block replication queue with ""Repository error during node import: Access denied"" error","Replication queue cannot process remaining items in queue when  image replication fails with ""Repository node import error: access denied‹ error. This happens only with a few images most get replicated. Could it be possible that it's these images are too big? We see  HTTP/1.1 400 Bad Request"" in the replication agent logs (pasted below). ------------------------------------------------------------------------------------------------------------------------------------------------------------------------------------------------------ 22.01.2015 15:45:37 - INFO - publish-c2cmsp-x01t : Replication (ACTIVATE) of /content/dam/images/entertainment/shows/c/call-the-midwife/callthemidwide_showcarousel.jpg not successful. 22.01.2015 15:46:34 - INFO - publish-c2cmsp-x01t : Sending POST request to http://c2cmsp-x01t:4503/bin/receive?sling:authRequestLogin=1 22.01.2015 15:46:34 - INFO - publish-c2cmsp-x01t : sent. Response: 400 Bad Request 22.01.2015 15:46:34 - ERROR - publish-c2cmsp-x01t : Replication (ACTIVATE) of /content/dam/images/entertainment/shows/c/call-the-midwife/callthemidwide_showcarousel.jpg not successful. Conversation follows 22.01.2015 15:46:34 - ERROR - publish-c2cmsp-x01t : ------------------------------------------------ 22.01.2015 15:46:34 - ERROR - publish-c2cmsp-x01t : Sending message to c2cmsp-x01t:4503 22.01.2015 15:46:34 - ERROR - publish-c2cmsp-x01t : >> POST /bin/receive HTTP/1.0 22.01.2015 15:46:34 - ERROR - publish-c2cmsp-x01t : >> Action: Activate 22.01.2015 15:46:34 - ERROR - publish-c2cmsp-x01t : >> Path: /content/dam/images/entertainment/shows/c/call-the-midwife/callthemidwide_showcarousel.jpg 22.01.2015 15:46:34 - ERROR - publish-c2cmsp-x01t : >> Handle: /content/dam/images/entertainment/shows/c/call-the-midwife/callthemidwide_showcarousel.jpg 22.01.2015 15:46:34 - ERROR - publish-c2cmsp-x01t : >> Referer: about:blank 22.01.2015 15:46:34 - ERROR - publish-c2cmsp-x01t : >> ...spooling 16232931 bytes... 22.01.2015 15:46:34 - ERROR - publish-c2cmsp-x01t : -- 22.01.2015 15:46:34 - ERROR - publish-c2cmsp-x01t : << HTTP/1.1 400 Bad Request 22.01.2015 15:46:34 - ERROR - publish-c2cmsp-x01t : << Connection: Close 22.01.2015 15:46:34 - ERROR - publish-c2cmsp-x01t : << Server: Day-Servlet-Engine/4.1.52 22.01.2015 15:46:34 - ERROR - publish-c2cmsp-x01t : << Content-Type: text/plain;charset=utf-8 22.01.2015 15:46:34 - ERROR - publish-c2cmsp-x01t : << Content-Length: 103 22.01.2015 15:46:34 - ERROR - publish-c2cmsp-x01t : << Date: Thu 22 Jan 2015 02:46:34 GMT 22.01.2015 15:46:34 - ERROR - publish-c2cmsp-x01t : << s-maxage: 120 22.01.2015 15:46:34 - ERROR - publish-c2cmsp-x01t : << Cache-Control: no-cache no-store must-revalidate 22.01.2015 15:46:34 - ERROR - publish-c2cmsp-x01t : << 22.01.2015 15:46:34 - ERROR - publish-c2cmsp-x01t : << error: com.day.cq.replication.ReplicationException: Repository error during node import: Access denied. 22.01.2015 15:46:34 - ERROR - publish-c2cmsp-x01t : Message sent. 22.01.2015 15:46:34 - ERROR - publish-c2cmsp-x01t : ------------------------------------------------ 22.01.2015 15:46:34 - INFO - publish-c2cmsp-x01t : Replication (ACTIVATE) of /content/dam/images/entertainment/shows/c/call-the-midwife/callthemidwide_showcarousel.jpg not successful. 22.01.2015 15:47:34 - INFO - publish-c2cmsp-x01t : Sending POST request to http://c2cmsp-x01t:4503/bin/receive?sling:authRequestLogin=1 22.01.2015 15:47:35 - INFO - publish-c2cmsp-x01t : sent. Response: 400 Bad Request This is the SAME ISSUE mentioned in the following ticket I found when searching the internet: https://forums.adobe.com/thread/1130975 But this was never answered. Error.log extract from the publisher attached. Attached is the image package. You need  Author and Publisher instances and configure the Default Publish Agent to use a different user (not admin) for transport user. This user (lets call it ""replication-publisher"" user) should exist on both author and publisher and should be given full access to everything under /content. Then activate the image from damadmin. You'll see in the replication queue and you should see the ""Repository error during node import: Access denied"". Funnily enough i could replicate it in my previous author-publisher instance but not in a mode recent one. But this happens in all our environments for particular large images. Please note that when you use 'admin'  transport user the replication is successful. The permissions on the replication-publisher transport isn't the issue though - this user has full access to /content node on both author and publisher. "
ims-e9453637539ad78b0a490d44@adobeid.com,1,Reply,Thanks for taking the time to reply However it only happens for 3-4 random images allothers replicate fine. p.s:We're using CQ5.6.1 which has a fewreplication bugs fixed since CQ5.5. 
ims-7b2c08c246832d599920157f@adobeid.com,1,Reply,This may be a bug that was fixed with a previous fix. You should open a ticket and the support people will let you know if this was a fix that was addressed or a new bug. Open a ticket here:http://helpx.adobe.com/marketing-cloud/experience-manager.html. 
ims-e9453637539ad78b0a490d44@adobeid.com,1,Reply,Thanks. Yes I have already raised a supportticket with Daycare:https://daycare.day.com/content/home/biztech/biztech_au/partner_services/67183.html#post0003. 
ims-aea414f64e3935fd0a490d45@adobeid.com,1,Reply,Hi abdon Seems like it is upgraded instance. If so have you followed [1]. There are no easy steps after postupgrade if so please create a new user with right permission & use it in replication agent. [1] http://helpx.adobe.com/experience-manager/kb/replication-privileges-missing-after-upgrade-to-cq-5-5.html Thanks 
ims-459f0ca146579924992015d5@adobeid.com,0,Is there a way to configure CQ such that modifying a page directly on a publisher instance invalidates it from the dispatcher cache? ,Hi I have a job that runs on all publisher instances and continuously touches some pages (it modifies their cq:lastModified and cq:lastModifiedBy properties). I was expecting the pages to be invalidates from the dispatcher cache  a consequence of this but they are not. Of course I can modify the pages on the author and activate them but is there a way to achieve this directly on the publisher instances without having to activate content from author to publishers first? Thanks. 
ims-7f5a4a3c42075ef399201549@adobeid.com,1,Reply,Hi Ideally we shouldnot be changing anything directly on the publish instance. Perfect would be to update in the author and activate them. But if it has to be donethen you will have to write a code to invalidatecache 
ims-166500c250207ee30a0550ba@adobeid.com,1,Reply,  You can write a event listener service which is run mode aware. You can can listen to relevant jcr events and trigger content flush from publish. You'll have to setup flush agent on publish .instances.
ims-4ba05f0f49dc1a7f992015a8@adobeid.com,0,Will Adobe plan to build dispatcher module for Nginx?,Hi everyone I prefer Nginx rather Apache2 because it's light simple and quicker than Apache2. So will Adobe plan to build dispatcher module for Nginx? If not how i can leverage the advantages from Nginx? 
ims-4ba05f0f49dc1a7f992015a8@adobeid.com,1,Reply,Thanks So i will aman for good news from Adobe and hopefully they get it works soon. 
ims-aea414f64e3935fd0a490d45@adobeid.com,1,Reply, aarons wrote... Hey is this nginx module under way? Or would we still need to submit a requirement for it. Thanks aarons  Hi aarons Please submit to get it prioritized with strong business case. Thanks 
ims-aea414f64e3935fd0a490d45@adobeid.com,1,Reply, aas wrote... Hi everyone I prefer Nginx rather Apache2 because it's light simple and quicker than Apache2. So will Adobe plan to build dispatcher module for Nginx? If not how i can leverage the advantages from Nginx?  Enhancement request is placed (DISP-338) file daycare with your business case. 
ims-9a830d805006cf220a490d44@adobeid.com,1,Reply,Hey is this nginx module under way? Or would we still need to submit a requirement for it. Thanks aarons 
ims-aea414f64e3935fd0a490d45@adobeid.com,1,Reply, aas wrote... Thanks So i will aman for good news from Adobe and hopefully they get it works soon. Please make sure to file support ticket it helps to know customer info & business case to prioritize the enhancements features. 
ims-a0aa19f0513f4ad10a490d4c@adobeid.com,0,How to override service ?,Hi all We use Content Sync for page exporting andfaced with the problem that PageExporter fails when exported page requiressession. Thereforei desided to overridecom.day.cq.contentsync.handler.util.RequestResponseFactory to provide fake request with session object. But simple declaration: @Component(immediate = true metatype = true) @Service(RequestResponseFactory.class) public class RequestResponseFactoryImpl implements RequestResponseFactory {  ... } of course not have any effect. So how can i tell AEM to take my service instead of already installedcom.day.cq.contentsync.impl.handler.util.RequestResponseFactoryImpl ? 
ims-aea414f64e3935fd0a490d45@adobeid.com,1,Reply,http://www.osgi.org/javadoc/r2/org/osgi/framework/Constants.html#SERVICE_RANKING 
ims-b2df5fed4e8950a40a490d44@adobeid.com,0,How to rewrite XML response using SAX pipeline with right configuration,"Hi i have custom transformer( that is global one name=""pipeline.mode"" value=""global"") which has the logic to rewrite public urls from html and xml respose but it is working for html now i want to extend this for xml  well how to do that? I need right configuration. Could you plase let me know how to achieve? "
ims-b2df5fed4e8950a40a490d44@adobeid.com,1,Reply, But what should be the right values for generatortype and serializer type for xml response What should be given for contenttype(app/xml ?) 
ims-aea414f64e3935fd0a490d45@adobeid.com,1,Reply,Just giving extension not sufficient. You need to specify transformer & serlizer for xml. For  example of oob for html & pdf refer /libs/cq/config/rewriter/* Some additional questions answered  http://www.wemblog.com/2011/08/how-to-remove-html-extension-from-url.html 
ims-b2df5fed4e8950a40a490d44@adobeid.com,1,Reply,For now how to achieve the xml rewrite? Are there any examples?
ims-b2df5fed4e8950a40a490d44@adobeid.com,1,Reply,I'm little confused with the configuration  i have configured factory  global(currently i do not have any configuration in place for html response rewrite) should i specify the generator and serializer since those are mandatory in the configuration or just can i give extesion and content is that suffice. Could you please clarify on the configuration(configuration). 
ims-aea414f64e3935fd0a490d45@adobeid.com,1,Reply,For the extension have you added xml ? http://sling.apache.org/site/output-rewriting-pipelines-orgapacheslingrewriter.html 
ims-158465f44cd8a8a40a746c1b@adobeid.com,1,Reply,There aren't any generators or serializers ootb which handle plain XML. I'm in the process of adding a generator to ACS AEM Commons:https://github.com/Adobe-Consulting-Services/acs-aem-commons/pull/48 but it sounds like there would also be a use for a serializer. 
ims-a81f2cad5474e7ba0a4c98c6@adobeid.com,0,Touch UI Thumbnails,  far  the touch ui the only info I have about thumbnails is what i've reverse engineered from the alsobrook store (the docs were not helpful). I want to have these thumbnails in my package I do not want the user to have to upload/configure them. In sites.html/content I have added thumbs in /content/my-store/jcr:content/image/file/jcr:content/dam:thumbnails and these show up correctly. This seems like  awful place to have to put my thumbs so I assume its incorrect and I should be loading them from somewhere else? With the same sites.html page if I dont have any thumbs configured it shows me a alsobrook homepage is this the default? (If i go into /libs/wcm/core/content/sites/properties.html/content/my-store I get  error if i try to 'generate preview' would this affect which thumbnails is displayed). I have aem commerce installed and configured for my store but when I go to /aem/catalogs.html/content/catalogs there is no image. The alsobrook catalog image url is /content/dam/geometrixx-outdoors/geometrixx-outdoors.thumb.319.319.png but even after copying that directory into the corresponding location in my-store and renaming it It still fails to display  image (even the wrong one). How does aem decide to use this image url? (the one for my store is always empty i.e. no src attribute) 
ims-aea414f64e3935fd0a490d45@adobeid.com,1,Reply,HI'm It is product bug & The issue has been filled internally CQ-22271. Please file a daycare along with your business case to verify & prioritize the bug. Thanks  Twitter: 
ims-976b7596503a54040a490d4d@adobeid.com,0,Documentum connector for CRX,I'm following this tutorialhttps://dev.day.com/docs/en/crx/connectors/documentum/current.html#Requirements to establish connection between CRX 2.2( CQ5.4) and Documentum 6.6 I've downloadedcrx2documentum-2.0.0.20070904 connector but I'm not sure whether this connector supportsCRX 2.2 and Documentum 6.6 version.  per the documentation mentioned in that url it says supported Documentum versions are 5.2 and 5.3 and CRX supported version is 1.3 Can someone please confirm that link is not updated and crx2documentum connector supportsCRX 2.2 and Documentum 6.6? Thank you 
ims-aea414f64e3935fd0a490d45@adobeid.com,1,Reply,Please file daycare to get official answer & to remove the page if it is not supported. 
ims-2c3400ee5050df540a0550b6@adobeid.com,0,Website Http to HTTPS movement,"Hi Could you please provide your inputs on the below 1> what is adavantage of Configuring Mutual SSL Between Dispatcher and AEM  per http://docs.adobe.com/docs/en/dispatcher/disp-ssl.html#par_title_2. trying to understand the reason when user browser hits dispacther say https://www.abb.com it https by then now what is the need to make request from dispacther from dispacther to AEM again ssl?? 2> should i get spearate CA certificates for dispacther and cq instance or just one certifacte for both will do?? https://docs.adobe.com/docs/en/dispatcher/disp-ssl.html#CREATING OR OBTAINING CA-SIGNED CERTIFICATES If I have purchased ssl certificate from CA THEN IN the folder /usr/local/ssl/misc. should i run the command ./CH.sh -newreq if not what are the exacat commands if I have thrid party CA certificate with me 3> Where does dispkey.pem present in Apache server docs.adobe.com/docs/en/dispatcher/disp-ssl.html#Configuring SSL for the Dispatcher Module 4>http://docs.adobe.com/docs/en/dispatcher/disp-ssl.html#Adding the CA Cert to the Render's Truststore What is the need of adding CA certificate to JVM??? 5>I need to re-direct 301  dispacther i looking  when client browsers hit the dspacther it can redirect to https. so what is the exact entry i will do for this activity in dispacther.any or any apache config files.could you provide the sinnpet.?? Things i have done:- I have setup  redirect rule  per https://docs.adobe.com/docs/en/cq/5-6-1/deploying/config-ssl.html#Forcing the Use of the SSL Port Click the /etc/map/http folder and click Create > Create Node: Name: localhost.4502 Type: sling:mapping Create the following property for this node: Name: sling:redirect Type: String Value: https://localhost:5433 Name: sling:status Type: Long So i see that when the hit the url http://localhost:4502 it redirects to https://localhost:5433. But I see that this is happening  AEM instance but instead want it  dispatcher level.how to do it?? 6> I have the CA certificate for SSL.  per https://docs.adobe.com/docs/en/cq/5-6-1/deploying/config-ssl.html#OBTAIN A CREDENTIAL FOR USE IN PRODUCTION Now what is the order i should execute the commands the commands under the folder [quickstart_dir]/ssl can i just run the below commands command1 keytool -importcert -trustcacerts -file rootcert.pem -keystorekeystorename.keystore -alias root command2 keytool -importcert -trustcacerts -file CACertificateName.crt -keystore keystorename.keystore Or do I have run the below commands (command3 and command4) and then run the (command1 and command2) please suggest command3 keytool -genkeypair -keyalg RSA -validity 3650 -alias cqse -keystore [quickstart_dir]/ssl/keystorename.keystore -keypass key_password -storepass storepassword -dname ""CN=Host Name OU=Group Name O=Company Name L=City Name S=State C=Country_ Code"" command4 keytool -certreq -alias ""LC Cert"" -keystorekeystorename.keystore -file LCcertRequest.csr 7.I need to move all the js css and DAM images present in instance http://localhost to https://localhost how do i acheive it? "
ims-aea414f64e3935fd0a490d45@adobeid.com,1,Reply," It deponds on your requirement 	 Generally browser to webserver or LB is secure afterwards it is non secure. since the request falls in your network. Majority of customer falls here. If you still want to secure till the end. There are two ways 		 AEM configure https & dispatcher usl ssl package and in render section set a flag secure to 1. Very few customer use this. (I hope for you this might be a fir) Another option is Mutual SSL that is two way & less than 1% customer I have see using this.  If you are still planning for mutual SSL then you need 2 certificate and you can't use the same. If you are still planning for mutual SSL you can place pem anywhere but in dispatcher config specify accordingly When secure request comes in aem deponds on jvm to check the certificate. For the jvm to validate you need to add into trust store. Most customer have own ca & good to add into jvm trust store. In the render section of dispatcher.any for secure port add additional entry /secure to 1 The output of 3 & 4 you pass to ca to certify & then execute 1 & 2. Ideally you will use all commands unless you get from different departments. It really deponds on your security process. Genrally both secure and non secure use same cache directory & no need to move anything. The validation happens on security layer. "
