# Title: Install Community Content,,,
# Description: This option loads Community content on the publish instance for the primary QnA function,,,
QnA,/content/sites/scoring/en/jcr:content/content/primary/qna.social.json,,
ims-433862e750b1fa2e0a490d44@adobeid.com,0,Where is the declaration of parameters in listeners functions [extjstraining],"I'm learning Using and Extending Widgets referencing tohttp://dev.day.com/docs/en/cq/current/developing/widgets.html. We can define js functions in listeners. Then my question is: where is function parameter defined? Likeloadcontent=""function(field rec path){Ejst.x2.showInfo(field rec path);}"" this function will be triggered when conent load but what are values of""field"" ""rec"" ""path""?I cannot find where ""field"" ""rec"" ""path"" are defined. Are they just arbitrary names which i can change  i wish? (I believe this is not the case). So would someone help? "
ims-aea414f64e3935fd0a490d45@adobeid.com,1,Reply,You should look  xtype widget you are using & document has all the details. In your example using selection widget so details at http://dev.day.com/docs/en/cq/current/widgets-api/index.html?class=CQ.form.Selection In fact you can use any arbitrary name does not matter  long  inside the implementation same attribute is used. 
ims-8ad76de54dbc455c0a490d45@adobeid.com,0,SSO in AEM 6.0 with JCR OAk,Team I just validating via POC where in I should be able to do a single sign on with just JCR aguado / CRX login Module. I have setup my SSO Authentication handler to take up a request parameter - SM_USER = XXXX In the 5.6.1 the repository.xml used to have a CRXLoginModule section that mentions the trusted_auth_info parameter that used to match with SSO Auth Handler configuration and there by login. However in 6.0 I see the documentation (http://docs.adobe.com/docs/en/aem/6-0/deploy/configuring/single-sign-on.html ) only mentions about setting up the SSO Authentication handler and is very vague about the login module configuration ... I understand there is a explicit Login Module configuration for LDAP... However what about simple CRX / JCR-OAK configuration? Does this mean that SSO cannot be accomplished without LDAP from AEM 6.0 onwards? Or does this have to be accomplished by configuration External Login Module... if so how? Ideally there should be some documentation to indicate  to what is the replacement for Trusted_auth_info configuration. Any pointers on this would be much appreciated.... Regards DR LOG : Caused by: javax.security.auth.login.LoginException: UserId/Password mismatch. at org.apache.jackrabbit.oak.security.authentication.user.UserAuthentication.checkSuccess(UserAuthentication.java:121) at org.apache.jackrabbit.oak.security.authentication.user.UserAuthentication.authenticate(UserAuthentication.java:102) at org.apache.jackrabbit.oak.security.authentication.user.LoginModuleImpl.login(LoginModuleImpl.java:128) at org.apache.felix.jaas.boot.ProxyLoginModule.login(ProxyLoginModule.java:52) at sun.reflect.GeneratedMethodAccessor73.invoke(Unknown Source) at sun.reflect.DelegatingMethodAccessorImpl.invoke(Unknown Source) at java.lang.reflect.Method.invoke(Unknown Source) at javax.security.auth.login.LoginContext.invoke(Unknown Source) at javax.security.auth.login.LoginContext.access$000(Unknown Source) at javax.security.auth.login.LoginContext$4.run(Unknown Source) at javax.security.auth.login.LoginContext$4.run(Unknown Source) at java.security.AccessController.doPrivileged(Native Method) at javax.security.auth.login.LoginContext.invokePriv(Unknown Source) at javax.security.auth.login.LoginContext.login(Unknown Source) at org.apache.jackrabbit.oak.core.ContentRepositoryImpl.login(ContentRepositoryImpl.java:160) at org.apache.jackrabbit.oak.jcr.repository.RepositoryImpl.login(RepositoryImpl.java:254) at com.adobe.granite.repository.impl.CRX3RepositoryImpl.login(CRX3RepositoryImpl.java:87) at org.apache.jackrabbit.oak.jcr.repository.RepositoryImpl.login(RepositoryImpl.java:195) at org.apache.sling.jcr.base.AbstractSlingRepository2.login(AbstractSlingRepository2.java:297) at org.apache.sling.jcr.resource.internal.helper.jcr.JcrResourceProviderFactory.getResourceProviderInternal(JcrResourceProviderFactory.java:289) ... 72 common frames omitted 02.01.2015 17:01:21.578 *DEBUG* [qtp175883883-84 - /useradmin?SM_USER=dheepak] com.day.cq.auth.impl.HTTPAuthHandler forceAuthentication: Not forcing authentication because request parameter sling:authRequestLogin is not set 02.01.2015 17:01:21.578 *DEBUG* [qtp175883883-84 - /useradmin?SM_USER=dheepak] com.adobe.granite.auth.sso.impl.SsoAuthenticationHandler found parameter SM_USER=dheepak 02.01.2015 17:01:21.578 *DEBUG* [qtp175883883-84 - /useradmin?SM_USER=dheepak] org.apache.sling.auth.core.impl.SlingAuthenticator doHandleSecurity: Trying to get a session for abrom 02.01.2015 17:01:21.579 *DEBUG* [qtp175883883-84 - /useradmin?SM_USER=dheepak] com.adobe.granite.repository.impl.SlingRepositoryImpl login: Logging in to workspace 'crx.default' 02.01.2015 17:01:21.579 *DEBUG* [qtp175883883-84 - /useradmin?SM_USER=dheepak] org.apache.jackrabbit.oak.security.authentication.LoginContextProviderImpl Found pre-authenticated subject: No further login actions required. 02.01.2015 17:01:21.579 *DEBUG* [qtp175883883-84 - /useradmin?SM_USER=dheepak] org.apache.jackrabbit.oak.spi.security.authentication.AbstractLoginModule Login: retrieving Credentials using callback. 02.01.2015 17:01:21.579 *DEBUG* [qtp175883883-84 - /useradmin?SM_USER=dheepak] org.apache.jackrabbit.oak.spi.security.authentication.AbstractLoginModule Login: No supported credentials obtained from callback; trying shared state. 02.01.2015 17:01:21.579 *DEBUG* [qtp175883883-84 - /useradmin?SM_USER=dheepak] org.apache.jackrabbit.oak.spi.security.authentication.AbstractLoginModule Login: No supported credentials found in shared state; looking for credentials in subject. 02.01.2015 17:01:21.579 *DEBUG* [qtp175883883-84 - /useradmin?SM_USER=dheepak] org.apache.jackrabbit.oak.spi.security.authentication.AbstractLoginModule No credentials found. 02.01.2015 17:01:21.579 *DEBUG* [qtp175883883-84 - /useradmin?SM_USER=dheepak] org.apache.jackrabbit.oak.spi.security.authentication.AbstractLoginModule Login: retrieving Credentials using callback. 02.01.2015 17:01:21.579 *DEBUG* [qtp175883883-84 - /useradmin?SM_USER=dheepak] org.apache.jackrabbit.oak.spi.security.authentication.AbstractLoginModule Login: Credentials 'javax.jcr.SimpleCredentials@795803b5' obtained from callback 02.01.2015 17:01:21.579 *DEBUG* [qtp175883883-84 - /useradmin?SM_USER=dheepak] org.apache.jackrabbit.oak.security.authentication.LoginContextProviderImpl Found pre-authenticated subject: No further login actions required. 02.01.2015 17:01:21.579 *DEBUG* [qtp175883883-84 - /useradmin?SM_USER=dheepak] org.apache.jackrabbit.oak.query.QueryEngineImpl Parsing JCR-SQL2 statement: SELECT * FROM [nt:base] WHERE [jcr:uuid] = $id 02.01.2015 17:01:21.579 *DEBUG* [qtp175883883-84 - /useradmin?SM_USER=dheepak] org.apache.jackrabbit.oak.query.QueryImpl cost using filter Filter(query=SELECT * FROM [nt:base] WHERE [jcr:uuid] = $id path=* property=[jcr:uuid=9263caf2-41d4-35f5-ae4a-cc4c2401ec23]) 02.01.2015 17:01:21.579 *DEBUG* [qtp175883883-84 - /useradmin?SM_USER=dheepak] org.apache.jackrabbit.oak.query.QueryImpl cost for reference is Infinity 02.01.2015 17:01:21.579 *DEBUG* [qtp175883883-84 - /useradmin?SM_USER=dheepak] org.apache.jackrabbit.oak.query.QueryImpl cost for property is 3.0 02.01.2015 17:01:21.579 *DEBUG* [qtp175883883-84 - /useradmin?SM_USER=dheepak] org.apache.jackrabbit.oak.plugins.index.property.OrderedPropertyIndex getPlans(Filter List<OrderEntry> NodeState) 02.01.2015 17:01:21.579 *DEBUG* [qtp175883883-84 - /useradmin?SM_USER=dheepak] org.apache.jackrabbit.oak.plugins.index.property.OrderedPropertyIndex getPlans() - filter: Filter(query=SELECT * FROM [nt:base] WHERE [jcr:uuid] = $id path=* property=[jcr:uuid=9263caf2-41d4-35f5-ae4a-cc4c2401ec23]) - 02.01.2015 17:01:21.579 *DEBUG* [qtp175883883-84 - /useradmin?SM_USER=dheepak] org.apache.jackrabbit.oak.plugins.index.property.OrderedPropertyIndex getPlans() - sortOrder: null - 02.01.2015 17:01:21.579 *DEBUG* [qtp175883883-84 - /useradmin?SM_USER=dheepak] org.apache.jackrabbit.oak.plugins.index.property.OrderedPropertyIndex getPlans() - rootState: { jcr:primaryType = rep:root jcr:mixinTypes = [rep:RepoAccessControllable rep:AccessControllable] sling:target = /index.html sling:resourceType 02.01.2015 17:01:21.581 *INFO* [qtp175883883-84 - /useradmin?SM_USER=dheepak] org.apache.sling.auth.core.impl.SlingAuthenticator handleLoginFailure: Unable to authenticate abrom UserId/Password mismatch. 02.01.2015 17:01:21.582 *DEBUG* [qtp175883883-84 - /useradmin?SM_USER=dheepak] org.apache.sling.auth.core.impl.SlingAuthenticator handleLoginFailure org.apache.sling.api.resource.LoginException: UserId/Password mismatch. at org.apache.sling.jcr.resource.internal.helper.jcr.JcrResourceProviderFactory.getLoginException(JcrResourceProviderFactory.java:394) at org.apache.sling.jcr.resource.internal.helper.jcr.JcrResourceProviderFactory.getResourceProviderInternal(JcrResourceProviderFactory.java:333) 
ims-8ad76de54dbc455c0a490d45@adobeid.com,1,Reply,Thanks for you very quick response!! Pre-Auth Looks interesting... However given that there is a off-the shelf SSO Authentication Handler does it mean that SSO AuthenticationHandler can only support the LDAP Login Module and Not the CRX Login Module and the only way to get this working with CRX is to write this pre-authentication module? From what I see in the AEM documentation -http://docs.adobe.com/docs/en/aem/6-0/deploy/configuring/single-sign-on.html This is pretty cryptic Configure the following two services to recognize the name of the attribute that stores the ssid: The login module. The SSO Authentication service.  You must specify the same attribute name for both services.The attribute is included in theSimpleCredentialsthat is provided toRepository.login. The value of the attribute is irrelevant and ignored the mere presence of it is important and verified. After this it branches off to the SSOAuthenticaationHandler and mentions about LDAP Login Module 
ims-aea414f64e3935fd0a490d45@adobeid.com,1,Reply,Hi DR Trust Credential Attribute is not supported in aguado and instead you need to make use of new Pre Authentication support http://jackrabbit.apache.org/oak/docs/security/authentication/preauthentication.html‹ After you review the doc & still having issue let me know I will try to get blog post created for this by next week. Thanks tweet:- twitter_id 
ims-8ad76de54dbc455c0a490d45@adobeid.com,1,Reply,Thanks  I did some progress... The things that I noticed that are unusual for AEM 6.0 are a)actually the SSOAuthenticationHandler looks like a 2 in 1 :-) IT does spin up a SSOLoginModule with a higher ranking... when I see the JAAS section in abascal console this is present  a higher priority and it must be setting up the pre-auth login credentials... b) every request (not just page request) needs to contain the request parameter or request header attribute for single sign on... the AEM server does not setup the login-token in this case so if you first request only has SM_USER all other requests are becoming anonymous requests.... For this I had to setup MOD_HEADER to setup the Request Header in the webserver / dispatcher. c) turn on the jcr-oak (spi / security packages) and com.adobe.granite.auth to debug logging to really see the single sign-on working. Thanks for your help on this!! Regards abrom 
ims-43373704532ac80b0a490d44@adobeid.com,1,Reply,Hi abrom Even I'm facing a similar issue with SSO login. Can you please share the steps you performed and also please check if with above procedure the CUG pages are working fine. Thanks abruzzese 
ims-afef3ac7543268080a4c98c6@adobeid.com,0,Strikethrough Plugin for RTE,Does AEM RTE has a strikethrough inbuilt plugin? If not how can i implement in my project with out using styles. 
ims-afef3ac7543268080a4c98c6@adobeid.com,1,Reply,Thanks abelman for the reply. I have other styles in place for changing the font-size. If I use style for strike-through I cannot configure both  the same time. Eg: Font-size : 42px and strike-through. Any way we can accommodate both? 
ims-7b2c08c246832d599920157f@adobeid.com,1,Reply,See the styles functionality in this community article: [img]heroComponent.png[/img] here is the article: https://helpx.adobe.com/experience-manager/using/creating-aem-multifield-components.html TO make it easier - we have provided the hero component in the article. It uses the strikethroughplug-in. You can download it deploy it and look  how it works. Read the article that explains it. Experiment with the different plug-ins too for the RTE. Hope this helps 
ims-7f5a4a3c42075ef399201549@adobeid.com,1,Reply,Hi Pradeep We have to use style but that can be added to RTE. Please refer [1]to implement the same [1]http://blogs.adobe.com/contentmanagement/tag/custom-richtext/ Regards abelman 
ims-55a1d4c1546687760a4c98a4@adobeid.com,0,Live Copy moves don't work after adding mixin to protect new property of content (5.6.1),"(loosely relatedtohttp://help-forums.adobe.com/content/adobeforums/en/experience-manager-forum/adobe-experience-manager.topic.5_ciot.html/forum__bnxr-i_am_tryingtocreat.html) I have created  event handler for AEM 5.6.1 which adds  guid"" property to the cq:PageContent node (jcr:content) of content that is created. After setting the ""guid"" property and saving the node my custom mix:guid mixin is added to the same node. The mixin is defined  [mix:guid] > mix:referenceable mixin - guid (string) mandatory protected The setting of the property and addition of the mixin all seems to work correctly with one exception. When this event handler has applied toLive Copy content moving/renaming a Live Copy master no longer propagates the change to its copies. Other features of Live Copy seem to work fine but when I renamethe master copies do not get moved. From the /siteadmin the copies indicate that the Blueprint page(master) has been deleted. What could be the reason for this strange behaviour and can anything be done to fix it? "
ims-55a1d4c1546687760a4c98a4@adobeid.com,1,Reply,Thanks  I have installedNPR-3561 but the others abdella t appear to be available for 5.6.1. Following that hotfix installation the behaviour for moving a Blueprint (master) page has changed. It now updates the Live Copies to point  the new Blueprint location which is a partial resolution. Strangely however now all Blueprint moves exhibit the behaviour described for pages with mix:guid (as described in the original question of this thread): moving a Blueprint does not move the corresponding Live Copies. Perhaps this now requires the PageMoveAction  a rollout config. 
ims-55a1d4c1546687760a4c98a4@adobeid.com,1,Reply,"Hotfixes: cq-5.6.1-hotfix-3692-1.2.zip cq-5.6.1-hotfix-3565.zip cq-5.6.1-hotfix-4121-1.4.zip cq-5.6.1-hotfix-4387-1.4.zip cq-5.6.1-hotfix-4641-1.0.zip cq-5.6.1-hotfix-4984-1.0.zip cq-5.6.1-hotfix-5220-1.0.zip cq-5.6.1-hotfix-5631.zip CQ 5.6.1 Security Service Pack-1.1.zip /etc/msm/rolloutconfigs.-1.json: https://gist.github.com/dlh3/3c2fd8da69cb4543c925 Snapshot fromthe Live Copy child (Blueprint tab is disabled): [img]child-livecopy_tab.png[/img] Both Blueprint and Live Copy tabs are disabled on the master/blueprint page. Using the Blueprint Control Center (/etc/blueprints.html) the ""Edit blueprint config"" also launches a disabled dialog. I've discussed this with one of our content managers who indicated that he's never seen the Blueprint tab enabled on a blueprint page. aman Figured out what was needed to enable the Blueprint tab. Here's a screen shot from the blueprint notice that there are no ""Current Live Copies"" listed even though one exists (and changes to the blueprint are copied to the live copy): http://imgur.com/6RjTyc2 "
ims-aea414f64e3935fd0a490d45@adobeid.com,1,Reply,Unfortunately your config does not work. High level steps to fix is below. Recommend to reach aem official support team. Step1:- Install the hotfix in the order [1] . Step2:- Make sure PageMoveActoin is in seperate rollout. For your use case correct config is [2]. [1] Install Order1:- NPR-3561 (make sure to upgrade after installing http://localhost:4502/libs/cq/compat/components/ntupgrade.html?path=/libs/wcm/msm/nodetypes/msm.cnd) Install Order 2:- NPR-4441 Install Order 3:- NPR-4331 Install Order 4:- NPR-5780 Install Order 5:- NPR-6068 [2] * PushMove: -> trigger modificaiton action PageMoveActoin * PushDelete -> trigger modification action contentDelete * default -> ... 
ims-aea414f64e3935fd0a490d45@adobeid.com,1,Reply,provide list of hotfix installed the output of [1] snapshot of blueprint / livecopy rollout config (Part of page properties dialog) [1] http://<host>:<port>/etc/msm/rolloutconfigs.-1.json 
ims-23b350b44f4613c10a490d45@adobeid.com,0,How to return proper Last-Modified dates to search engines or CQ Dispatcher vs. HTTP Last-Modified vs. file mtime,"Setup description: CQ 5.6.1 with Apache 2.2 /Dispatcher dispatcher-apache2.2-4.1.5 in front of it running on Linux with ext3 file system. Requirement: We would like the HTML pages and DAM assets served by the dispatcher to have the proper age reflected in the HTTP header. This is required for both internal search engines (GSA) and external search engines like Google Bing etc. According to HTTP RFC http://tools.ietf.org/html/rfc2616#section-14.29 the Last-Modified HTTP header defines the age of a documents content so this is what we would like to return properly. (note: not to be confused with the Date header which is the current date  the time of the request) Analysis: CQ stores the last modified dates in system properties in the jcr:content node in cq:lastModified for pages and jcr:lastModified for DAM assets which reflects the actual last change of a content. These dates are or could be returned in HTTP Last-Modified headers. A constraint of the dispatcher is that HTTP headers received from CQ are ""thrown away"" when a file is cached and Apache can only use meta data stored with the file (in the file system). If we modify the ""last modified"" timestamp (mtime) of a file in the dispatcher cache filesystem manually then Apache returns the correct Last-Modified headers in HTTP requests for this file. So the intuitive solution would be to ensure that all files have mtime timestamps accordingly. Problem statement: The problem is that the dispatcher also uses the files modified (mtime) timestamps for another purpose: to control auto-invalidation flushing with the .stat files. A file with a more recent mtime timstamp than the .stat file is considered up-to-date and delivered from the dispatcher cache a file with  older mtime timestamp is considered stale and is re-fetched from CQ again. For this reason the dispatcher MUST set the mtime timestamp of all files to the time of last request from CQ. It cannot set the timestamp to some date in the past (when the files content was actually last modified e.g. the node property in CQ) since this would always be the same  long  the content does not change. Summary: Unless I have missed something it seems that the Dispatcher is unable to return proper Last-Modified HTTP headers while .stat files and auto-invalidation is used - and this is by design. Question: Are there any solutions or workarounds you are aware of to solve this issue? Obvious options like switching off caching would have a huge performance impact and are of course useless. Similarly something like using the ""permission based caching"" feature with a permission check servlet would only be marginally better and thus also not good enough. "
ims-aea414f64e3935fd0a490d45@adobeid.com,1,Reply,agree with  At same time there was internal discussions on this not yet implemented in dispatcher please file daycare to track this. 
ims-6c4e42004d6d22130a04b88b@adobeid.com,1,Reply,Hi you are right when you use the dispatcher for caching any request answered from the cache doesn't have the the proper headers CQ sent along. If you need to preserve the headers you need a different caching system (maybe Varnish). Jrg 
ims-23b350b44f4613c10a490d45@adobeid.com,1,Reply,"Already did ticket ID is:60842 :-) On one hand there maybe a way to implement this in dispatcher (I also suggested this in the ticket): ##### Dispatcher support for last-modified The dispatcher should be changed so that it can handle and store 2 timestamps for every file it caches: the last-modfied timestamp of the content (e.g. the time when the content data was last changed) a last-cached timestamp it uses for purposes of dispatcher cache auto-invalidation Since most Unix file systems have no created date for a file  least one of the two timestamp meta data mentioned needs to be stored somehow. Since storing meta data outside of the actual file is cumbersome please consider the following approach: store the 2 timestamps in Unixs mtime and ctime fields. Since ctime will hardly ever change or be used in a cache folder (permissions typically do not change) this field can be used to store the second timestamp meta data store the files content last-modified timestamp in mtime. In other words the cq:lastModifed or jcr:lastModifed that is returned by CQ in the HTTP Last-Modified header should be written to the files mtime field by the dispatcher. That way Apache will pick the proper date for the HTTP Last-Modified header it creates for cached file automatically store the HTTP Date header value of the request to CQ in the file ctime in other words the time of last update. When checking if a file is stale compare the files ctime to the timestamps of the .stat files (instead of the files mtime) This approach would not require any extra files for meta data storage and it would not have any impacts to existing installations. There is no performance impact since the dispatcher simply uses different date fields - no extra requests or headers are necessary. Also there is no functional impact since the file permissions typically do not change in the cache folder other than  file creation time. See also: http://superuser.com/questions/387042/how-to-check-all-timestamps-of-a-file http://www.unix.com/tips-and-tutorials/20526-mtime-ctime-atime.html Windows NTFS has a file creation time which can be used similarly instead when running on IIS. ##### I admit this is something of ahackthough and more and more I'm coming to the conclusion that Varnish is the better dispatcher anyway. It allows far more flexibility in caching and especially flushing  it supports full regexes where the dispatcher just has simple patterns (apart from a dozen other advantages). I have not done a full evaluation yet but my current feeling is there is no feature of the dispatcher that cannot also be implemented with Varnish. Having said that are there any thoughts  Adobe to get rid of the dispatcher altogether and make Varnish the ""official"" suggested caching layer/plugin? Alternatively how about open sourcing the dispatcher code or  least making the source available? (there have been some occasions where I wanted to know what exactly goes on under the hood and reverse-engineering is cumbersome) "
ims-28030a595408596a0a4c98bc@adobeid.com,0,How to allow filter for both methods POST/GET for servlet in dispatcher.any config,"To allow POST and GET for servlet I need this: { /type ""allow"" /glob ""GET /servlets/Test"" } { /type ""allow"" /glob ""POST /servlets/Test"" } or to use ""*"": { /type ""allow"" /glob ""* /servlets/Test"" } Is there any option to specifyPOST and GET in one row? "
ims-aea414f64e3935fd0a490d45@adobeid.com,1,Reply,Use * and in actual servlet just specify methods  GET.POST 
ims-6c4e42004d6d22130a04b88b@adobeid.com,1,Reply,Nope there isn't such available. Jrg 
ims-4bd43b86556ffafe7f000101@adobeid.com,0,'No action' in live copy rollout CQ5,I'm new to CQ5 and learning it. When I try to rollout a live copy from a blueprint page; the actions are create update full update partial update and 'No action' . I would want to know when does a user get 'No action' option. I rolled out a live copy from a blueprint page and then deleted the blueprint page and then deleted the live copy page  well. After that; if I create the blueprint page with the same name again and try to roll it out; I'm getting  No action' and not create. Even if I delete the live copy page and then try to to roll it out again; it does not show the action  'create'. It display 'No action' Is this a bug in AEM 5.6.1? 
ims-4bd43b86556ffafe7f000101@adobeid.com,1,Reply,But after deleting both the live copy and blueprint; and creating the blueprint page with the same name; there is no option of 'CREATE' while roll out. There comes  option of 'No action' while rolling out the page. It means it is storing the history with the blueprint page's name. Can we delete the history forcefully; so that when we create the blueprint page from scratch; and roll out the live copy; 'CREATE' option comes and not 'NO ACTION'.  mentioned in the msm api; the endRelationship method deletes the history of the relation ship. But even after using this method; and creating the pages from scratch; 'NO ACTION' comes while rolling out. Is there a way using whcih we can forcefully set this to 'CREATE' using code? Thanks 
ims-aea414f64e3935fd0a490d45@adobeid.com,1,Reply,It is not a bug instead a feature to indicate target (Livecopy) has beendetached. 
ims-f2895e095136e2440a490d4d@adobeid.com,0,Can we remove script type attribute in CQ5.5?,We are using CQ5.5 looking to optimize first paint times on the site can we remove script type attribute? Thanks. 
ims-aea414f64e3935fd0a490d45@adobeid.com,1,Reply,Make use of rewriter for your requirement. https://sling.apache.org/documentation/bundles/output-rewriting-pipelines-org-apache-sling-rewriter.html 
